<?xml version="1.0" encoding="UTF-8"?>
<xsd:schema xmlns:xsd="http://www.w3.org/2001/XMLSchema">
	<xsd:element name="content">
		<xsd:complexType>
		  <xsd:sequence>
			<xsd:element name="symbol" type="xsd:string"/>
			<xsd:element name="quantity" type="xsd:integer"/>
		  </xsd:sequence>
		  <xsd:attribute name="type" type="xsd:string"/>
		</xsd:complexType> 
	</xsd:element>
    <xsd:element name="contentList">
		<xsd:complexType>
			<xsd:sequence>
				<xsd:element ref="content" maxOccurs="unbounded"/>
			</xsd:sequence>
		</xsd:complexType>
	</xsd:element>
	<xsd:element name="basket">
		<xsd:complexType>
			<xsd:sequence>
				<xsd:element ref="contentList" maxOccurs="1"/>
			</xsd:sequence>
			<xsd:attribute name="name" type="xsd:string"/>
		</xsd:complexType>
	</xsd:element>
	<xsd:element name="basketList">
		<xsd:complexType>
			<xsd:sequence>
				<xsd:element ref="basket" maxOccurs="unbounded"/>
			</xsd:sequence>
		</xsd:complexType>
		
	</xsd:element>
</xsd:schema>